{
  "title": "",
  "kind": "effective_practice",
  "confidence": "medium",
  "frequency": "once",
  "scope": "session",
  "projects": [],
  "task_refs": [],
  "observation": "",
  "evidence": [],
  "interpretation": "",
  "cause": "not_applicable",
  "impact": "",
  "recommended_action": "",
  "suggested_artifact": "observation",
  "candidate_text_or_outline": "",
  "limits_and_counterexamples": "",
  "validation_plan": ""
}
